{
  "$schema": "https://json-schema.org/draft/2020-12/schema",
  "title": "Peek-Then-Pay Search Intent Response",
  "type": "object",
  "properties": {
    "intent": {
      "type": "string",
      "const": "search",
      "description": "Intent type identifier"
    },
    "query": { "type": "string" },
    "mode": { "type": "string", "enum": ["keyword", "vector", "hybrid"] },
    "scoringId": {
      "type": "string",
      "description": "Identifier of scoring func/model (e.g., bm25, te3l@v1)"
    },
    "results": {
      "type": "array",
      "items": {
        "type": "object",
        "properties": {
          "rank": { "type": "integer", "minimum": 1 },
          "score": {
            "type": "number",
            "description": "Higher = more relevant. Comparable within same scoringId."
          },
          "canonicalUrl": { "type": "string", "format": "uri" },
          "contentType": { "$ref": "common-defs.schema.json#/$defs/contentType" },
          "mediaType": { "$ref": "common-defs.schema.json#/$defs/mediaType" }
        },
        "required": ["rank", "score", "canonicalUrl"],
        "additionalProperties": false
      }
    }
  },
  "required": ["intent", "query", "mode", "scoringId", "results"],
  "additionalProperties": false
}
